{
  "password": "claude",
  "port": 9800,
  "host": "0.0.0.0",
  "logLevel": "info",
  "defaultProvider": "claude",
  "aliases": {
    "haiku": "claude-haiku-4-5",
    "sonnet": "claude-sonnet-4-6",
    "opus": "claude-opus-4-6"
  },
  "tierTimeouts": {
    "haiku": { "timeoutMs": 120000 },
    "sonnet": { "timeoutMs": 300000 },
    "opus": { "timeoutMs": 600000 }
  },
  "providers": {
    "claude": {
      "name": "Claude (Anthropic)",
      "baseUrl": "https://api.anthropic.com",
      "apiKey": "${ANTHROPIC_AUTH_TOKEN}",
      "models": ["claude-opus-4-6", "claude-sonnet-4-6", "claude-haiku-4-5"],
      "defaultModel": "claude-sonnet-4-6",
      "enabled": true,
      "prefix": "claude-",
      "passthrough": true
    },
    "kimi": {
      "name": "Kimi (Moonshot AI)",
      "baseUrl": "https://api.moonshot.cn/v1",
      "apiKey": "${MOONSHOT_API_KEY}",
      "models": ["kimi-k2.6", "kimi-k2.5", "kimi-k2"],
      "defaultModel": "kimi-k2.6",
      "enabled": false,
      "prefix": "kimi-"
    },
    "minimax": {
      "name": "MiniMax",
      "baseUrl": "https://api.minimaxi.com/v1",
      "apiKey": "${MINIMAX_API_KEY}",
      "models": ["MiniMax-M2.7", "MiniMax-M2.5", "MiniMax-M2.1", "MiniMax-M1"],
      "defaultModel": "MiniMax-M2.7",
      "enabled": false,
      "prefix": ["minimax-", "MiniMax-"]
    },
    "glm": {
      "name": "GLM (Zhipu AI)",
      "baseUrl": "https://open.bigmodel.cn/api/paas/v4",
      "apiKey": "${ZHIPUAI_API_KEY}",
      "models": ["glm-4-plus", "glm-4", "glm-4-air", "glm-4-flash", "glm-4-long"],
      "defaultModel": "glm-4-plus",
      "enabled": false,
      "prefix": "glm-"
    },
    "deepseek": {
      "name": "DeepSeek",
      "baseUrl": "https://api.deepseek.com/v1",
      "apiKey": "${DEEPSEEK_API_KEY}",
      "models": ["deepseek-chat", "deepseek-reasoner"],
      "defaultModel": "deepseek-chat",
      "enabled": false,
      "prefix": "deepseek-"
    }
  }
}
